### ISSUE TITLE
DNS leak when SOCKS5 proxy is configured

### ISSUE THREAD

**Issue by alnsn** [mollyim/mollyim-android#799]
### Guidelines

- [x] Yes, I have searched for existing issues

### Bug Description

Molly is configured to use SOCKS5 proxy (on port 9377), if I click on 'Check Connection', it shows green 'Online' but Molly never goes online. I suspect it's related to requests that bypass SOCKS5 because I deliberately reject all traffic, even DNS. Only SOCKS5 connection can connect to internet.

I don't know when it broke because I use this setup sporadically but I'm pretty sure it worked until recently.

```
# tcpdump -i wg1 not port 9377
tcpdump: verbose output suppressed, use -v or -vv for full protocol decode
listening on wg1, link-type NULL (BSD loopback), capture size 262144 bytes
20:48:26.581748 IP 10.0.3.1.44181 > 192.168.1.1.domain: 1738+ AAAA? grpc.chat.signal.org. (38)
20:48:26.581752 IP 10.0.3.1.13787 > 192.168.1.1.domain: 65075+ A? grpc.chat.signal.org. (38)
20:48:31.648533 IP 10.0.3.1.46473 > 192.168.1.1.domain: 65075+ A? grpc.chat.signal.org. (38)
20:48:31.648780 IP 10.0.3.1.34256 > 192.168.1.1.domain: 1738+ AAAA? grpc.chat.signal.org. (38)
20:48:31.878531 IP 10.0.3.1.34280 > one.one.one.one.https: Flags [S], seq 3355904009, win 65535, options [mss 1240,sackOK,TS val 1938865267 ecr 0,nop,wscale 8], length 0
20:48:32.911038 IP 10.0.3.1.34280 > one.one.one.one.https: Flags [S], seq 3355904009, win 65535, options [mss 1240,sackOK,TS val 1938866296 ecr 0,nop,wscale 8], length 0
20:48:34.932302 IP 10.0.3.1.34280 > one.one.one.one.https: Flags [S], seq 3355904009, win 65535, options [mss 1240,sackOK,TS val 1938868312 ecr 0,nop,wscale 8], length 0
20:48:36.588329 IP 10.0.3.1.36090 > 192.168.1.1.domain: 1120+ A? grpc.chat.signal.org. (38)
20:48:36.588332 IP 10.0.3.1.30052 > 192.168.1.1.domain: 28907+ AAAA? grpc.chat.signal.org. (38)
20:48:36.967063 IP 10.0.3.1.34296 > one.one.one.one.https: Flags [S], seq 2493991008, win 65535, options [mss 1240,sackOK,TS val 1938870348 ecr 0,nop,wscale 8], length 0
20:48:38.013070 IP 10.0.3.1.34296 > one.one.one.one.https: Flags [S], seq 2493991008, win 65535, options [mss 1240,sackOK,TS val 1938871352 ecr 0,nop,wscale 8], length 0
20:48:38.966323 IP 10.0.3.1.34280 > one.one.one.one.https: Flags [S], seq 3355904009, win 65535, options [mss 1240,sackOK,TS val 1938872348 ecr 0,nop,wscale 8], length 0
20:48:39.986584 IP 10.0.3.1.34296 > one.one.one.one.https: Flags [S], seq 2493991008, win 65535, options [mss 1240,sackOK,TS val 1938873368 ecr 0,nop,wscale 8], length 0
20:48:41.593343 IP 10.0.3.1.18681 > 192.168.1.1.domain: 28907+ AAAA? grpc.chat.signal.org. (38)
20:48:41.593597 IP 10.0.3.1.39868 > 192.168.1.1.domain: 1120+ A? grpc.chat.signal.org. (38)
20:48:44.123109 IP 10.0.3.1.34296 > one.one.one.one.https: Flags [S], seq 2493991008, win 65535, options [mss 1240,sackOK,TS val 1938877464 ecr 0,nop,wscale 8], length 0
20:48:46.693123 IP 10.0.3.1.58808 > 192.168.1.1.domain: 36376+ AAAA? grpc.chat.signal.org. (38)
20:48:46.693374 IP 10.0.3.1.53594 > 192.168.1.1.domain: 45680+ A? grpc.chat.signal.org. (38)
20:48:51.742908 IP 10.0.3.1.36637 > 192.168.1.1.domain: 36376+ AAAA? grpc.chat.signal.org. (38)
20:48:51.743157 IP 10.0.3.1.50144 > 192.168.1.1.domain: 45680+ A? grpc.chat.signal.org. (38)
```

### App Version

v8.19.2-3

### Device Model

Pixel Tablet

### Android Version

GrapheneOS
osVersion: google/tokay/tokay:17/CP2A.260705.006/2026071501:user/release-keys

**Comment by alnsn** [comment]
BTW, `"https://1.1.1.1/dns-query"` and `"https://9.9.9.9/dns-query"` should be configuration parameters instead of being hard-coded.

**Comment by alnsn** [comment]
` 192.168.1.1` comes from my home router (aka system DNS). It doesn't make much sense to query it when android is in 'always on VPN' mode but it's android problem, not yours.

**Comment by Freezable-Capricorn** [comment]
For me, this started happening in v8.19.2-2 (and still occurs in v8.19.2-3). In Orbot, I get the following warning:

> Message (STATUS_CLIENT): WARN DANGEROUS_SOCKS PROTOCOL=SOCKS5 ADDRESS=0.0.0.0:443
WARN: Your application (using socks5 to port 443) is giving Tor only an IP address. Applications that do DNS resolves themselves may leak information. Consider using Socks4A (e.g. via privoxy or socat) instead. For more information, please see https://2019.www.torproject.org/docs/faq.html.en#WarningsAboutSOCKSandDNSInformationLeaks

Allowing DNS traffic restores connectivity.

**Comment by alnsn** [comment]
> Allowing DNS traffic restores connectivity.

IPv6 DNS didn't restore connectivity, only when I switched to IPv4, it brought molly back online. I could even re-link a device.

**Comment by liamsmith827** [comment]
I am planning to audit Molly's networking code in future, so I had a quick look at this to begin familiarizing myself with the changes. I don't have a number registered on my test device, so everything I observed was from the introduction Activity.

In terms of the specifics, my report differs from the original report and from the report by @Freezable-Capricorn. I did see that with "Tor via Orbot" as the proxy setting, DNS requests for "chat.signal.org" (not "grpc.") were made outside the proxy using my local DNS server. I didn't see any requests to "1.1.1.1" being made outside the proxy.

I removed all references to "chat.signal.org" from the app code and these leaks persisted. I couldn't find anywhere in the app code that referenced "grpc.chat.signal.org", but I could find references to both "chat.signal.org" and "grpc.chat.signal.org" in libsignal. I would have liked to explore the libsignal component more, but I had to stop. I'll do some more looking if I get the chance.

Take all my testing with a grain of salt, it was more rushed than methodical.

> It doesn't make much sense to query it when android is in 'always on VPN' mode but it's android problem, not yours.

"Always on VPN" means very little. If you want to force the use of VPN DNS servers then you need to use "Block connections without VPN", and even then there's major issues with this. Graphene fixes some of the issues, with more fixes coming soon.

**Comment by liamsmith827** [comment]
In v8.7.3-2, the proxy type was being set to "socks5h" when an explicit proxy was specified (https://github.com/mollyim/mollyim-android/blob/v8.7.3-2/app/src/main/java/org/thoughtcrime/securesms/net/Networking.kt#L80). Since v8.19.2-2, this code has been removed and replaced by an unconditional reference to "socks5" (https://github.com/mollyim/mollyim-android/blob/v8.19.2-2/app/src/main/java/org/thoughtcrime/securesms/net/NetworkProxy.kt#L32). When not sending "socks5h", libsignal sets resolve_hostname_locally to true (https://github.com/mollyim/libsignal/blob/main/rust/net/infra/src/route/proxy.rs#L296).

I don't think the libsignal resolver is proxy aware, so https://github.com/mollyim/libsignal/commit/dfb342748fb8836dd257758d64b270dc66b46eac doesn't force its connections through the proxy.

I've tested updating the ProxyScheme SOCKS value to "socks5h" in mollyim-android and I get a good result from the connection check, with no proxy bypass observed. I won't open a PR as I still don't have a test number and can't verify this further. The patch probably also needs to consider whether the proxy source is USER or SYSTEM, as opposed to unconditionally setting "socks5h" as I've done.

Hopefully this helps.
